{"entries":[{"bound":{"scaleExponent":6,"value":8},"checkClass":"correctness","comparison":"at_most","metricGeneration":1,"metricId":"tick.duration.p99","policyKey":"tick_ceiling"}],"metricRegistryGeneration":1,"policyGeneration":1,"recordKind":"evaluation_policy","schemaVersion":1,"tier":"tier_0","trust":{"provenance":"diagnostic_untrusted"}}