{"entries":[{"bound":{"scaleExponent":0,"value":0},"checkClass":"correctness","comparison":"at_most","description":"An assertion that fired is a defect and is blocking at every tier.","metricGeneration":1,"metricId":"harness.assertion_failure.count","policyKey":"assertions_held"}],"metricRegistryGeneration":1,"policyGeneration":1,"recordKind":"evaluation_policy","schemaVersion":1,"tier":"tier_0","trust":{"provenance":"diagnostic_untrusted"}}