{"entries":[{"bound":{"scaleExponent":0,"value":0},"checkClass":"correctness","comparison":"at_most","description":"An assertion that fired is a defect and is blocking at every tier.","metricGeneration":1,"metricId":"harness.assertion_failure.count","policyKey":"assertions_held"},{"bound":{"scaleExponent":0,"value":0},"checkClass":"completeness","comparison":"at_most","description":"Evidence whose named raw attachments cannot be retrieved is incomplete.","metricGeneration":1,"metricId":"harness.attachment_missing.count","policyKey":"attachments_retrievable"},{"bound":{"scaleExponent":0,"value":0},"checkClass":"correctness","comparison":"at_most","description":"A broken invariant is a workload failure, never a slow result.","metricGeneration":1,"metricId":"harness.invariant_violation.count","policyKey":"invariants_held"},{"bound":{"scaleExponent":0,"value":1},"checkClass":"completeness","comparison":"at_least","description":"A run that recorded no sample proves nothing and is not eligible evidence.","metricGeneration":1,"metricId":"harness.observation.sample_count","policyKey":"observations_present"},{"bound":{"scaleExponent":0,"value":0},"checkClass":"correctness","comparison":"at_most","description":"A workload failure blocks; it is never relabelled as an infrastructure error.","metricGeneration":1,"metricId":"harness.workload_failure.count","policyKey":"workload_completed"}],"metricRegistryGeneration":1,"policyGeneration":1,"recordKind":"evaluation_policy","schemaVersion":1,"tier":"tier_0","trust":{"provenance":"diagnostic_untrusted"}}